{
  "description": "Official marketplace of Pupa MyApp bundles.",
  "entries": [
    {
      "appFormatVersion": 1,
      "appVersion": "0.0.257",
      "author": "pupa-app",
      "exportedAt": "2026-08-23T20:46:01Z",
      "homepage": "https://github.com/pupa-app/pupa",
      "icon": "briefcase",
      "id": "job-search-apply",
      "includedMemories": true,
      "includedRecords": false,
      "name": "Job Search & Apply",
      "path": "apps/job-search-apply/app.pupa",
      "screenshots": [],
      "sha256": "a9bdd1521c67c003ad00a8bf8ab3bfaef5884aba40727d8366b485243510f7a5",
      "sizeBytes": 84018,
      "summary": "Job-application pipeline: scouts boards, scores openings against your rubric, tailors and submits applications, tracks deadlines. Also finds and ranks career events. Needs host pandoc plus Playwright.",
      "tags": [
        "jobs",
        "career",
        "tracker",
        "automation",
        "productivity"
      ],
      "version": 3
    },
    {
      "appFormatVersion": 1,
      "appVersion": "0.0.212",
      "attribution": "Questionnaire: MSS-YSQ © NovoPsych, used under their Open Source Licence (CC BY-NC-SA). https://novopsych.com/assessments/formulation/mss-ysq-young-schema-questionnaire/",
      "author": "pupa-app",
      "exportedAt": "2026-01-15T00:00:00Z",
      "homepage": "https://github.com/pupa-app/pupa",
      "icon": "brain.head.profile",
      "id": "maladaptive-mechanisms",
      "includedMemories": true,
      "includedRecords": true,
      "license": "CC-BY-NC-SA-4.0",
      "name": "Maladaptive Mechanisms",
      "path": "apps/maladaptive-mechanisms/app.pupa",
      "screenshots": [],
      "sha256": "fb91fc9ca1284e293a5a99cc346143dc1c9bb14d2ef951000c5e9f89c633f4fd",
      "sizeBytes": 93731,
      "summary": "Schema-therapy self-tracker on the openly-licensed MSS-YSQ: a 76-item questionnaire, live schema scores, domain charts, and a schema/mode diary.",
      "tags": [
        "health",
        "schema-therapy",
        "self-reflection",
        "questionnaire",
        "tracker"
      ],
      "version": 1
    },
    {
      "appFormatVersion": 1,
      "appVersion": "0.0.201",
      "author": "pupa-app",
      "exportedAt": "2026-07-17T15:21:06Z",
      "homepage": "https://github.com/pupa-app/pupa",
      "icon": "flame.fill",
      "id": "myfire",
      "includedMemories": true,
      "includedRecords": true,
      "name": "MyFIRE",
      "path": "apps/myfire/app.pupa",
      "screenshots": [],
      "sha256": "57c887b695f55bd27ad769f84cb44c49a00a3bd4bcde24d86570ee37da99d078",
      "sizeBytes": 34955,
      "summary": "Personal FIRE planner: a profile tracker of your numbers feeding a calculator for savings rate, years to FIRE, and Lean/Regular/Fat/Coast/Barista variants.",
      "tags": [
        "finance",
        "fire",
        "calculator"
      ],
      "version": 1
    },
    {
      "appFormatVersion": 1,
      "appVersion": "0.0.257",
      "author": "pupa-app",
      "exportedAt": "2026-08-23T14:57:27Z",
      "homepage": "https://github.com/pupa-app/pupa",
      "icon": "cart",
      "id": "product-event-finder",
      "includedMemories": true,
      "includedRecords": true,
      "name": "Product & Event Finder",
      "path": "apps/product-event-finder/app.pupa",
      "screenshots": [],
      "sha256": "b5992e37882d0af022f58c409ff7f12622047b8f23fd4c29238e5fabc80b02a1",
      "sizeBytes": 32374,
      "summary": "Find any product or event: searches sellers, browser-verifies real stock, legitimacy-checks unknown sites, and tracks results — then preps checkout without ever touching your credentials.",
      "tags": [
        "shopping",
        "search",
        "tracker",
        "events",
        "tickets"
      ],
      "version": 2
    },
    {
      "appFormatVersion": 1,
      "appVersion": "0.0.180",
      "author": "pupa-app",
      "exportedAt": "2026-07-10T08:00:47Z",
      "homepage": "https://github.com/pupa-app/pupa",
      "icon": "chart.line.uptrend.xyaxis.circle",
      "id": "research-tracker",
      "includedMemories": true,
      "includedRecords": true,
      "name": "Research Tracker",
      "path": "apps/research-tracker/app.pupa",
      "screenshots": [],
      "sha256": "0c6ab874c3eb309c1e3e331b5863b4bca9653fa3c87610a50910b6c273be71f5",
      "sizeBytes": 24020,
      "summary": "Competitive-intel watchlist, weekly findings log, signal-trend chart, and a Scout/Analyst/Digest research room.",
      "tags": [
        "research",
        "competitive-intel",
        "dashboard"
      ],
      "version": 2
    },
    {
      "appFormatVersion": 1,
      "appVersion": "0.0.257",
      "author": "pupa-app",
      "exportedAt": "2026-08-25T21:19:24Z",
      "homepage": "https://github.com/pupa-app/pupa",
      "icon": "laptopcomputer.and.arrow.down",
      "id": "tidy-laptop",
      "includedMemories": true,
      "includedRecords": false,
      "name": "Tidy Laptop",
      "path": "apps/tidy-laptop/app.pupa",
      "screenshots": [],
      "sha256": "e7ce51c2501381d2c11cf79f0e12dff7bfd87b21ac61789f512cf0be5fa455ba",
      "sizeBytes": 33108,
      "summary": "Scan approved folders for junk, clutter, disk hogs, and exposed secrets; triage findings on a kanban and apply each fix recoverably (Trash/move, never rm) with a logged, reversible change record.",
      "tags": [
        "productivity",
        "cleanup",
        "disk",
        "tracker",
        "automation"
      ],
      "version": 1
    },
    {
      "appFormatVersion": 1,
      "appVersion": "0.0.180",
      "author": "pupa-app",
      "exportedAt": "2026-07-10T08:00:47Z",
      "homepage": "https://github.com/pupa-app/pupa",
      "icon": "sun.horizon",
      "id": "daily-briefing",
      "includedMemories": true,
      "includedRecords": true,
      "name": "Daily Briefing",
      "path": "apps/daily-briefing/app.pupa",
      "screenshots": [],
      "sha256": "3ecbb6b2b470df1fe141bf09fb2a895300de8b55401bdf083c8ca1cf902779d8",
      "sizeBytes": 18316,
      "summary": "A 7am briefing: named sources, today's digest, feed-volume chart, and a calendar for scheduled pulls.",
      "tags": [
        "briefing",
        "productivity",
        "dashboard"
      ],
      "version": 2
    }
  ],
  "formatVersion": 1,
  "name": "Pupa Marketplace",
  "owner": "pupa-app"
}
